{
  "$schema": "http://json-schema.org/draft-07/schema#",
  "title": "Matchup Brief",
  "description": "The objective, shared counterplay annotations for ONE opponent Variant Cluster (ADR-0027). Lives beside the auto-artifact at src/common/scouting/briefs/<slug>.json; authored by /matchup-genie, consumed (future) by the Read/Posture layer to populate Board opponent-property fields. Validated by scripts/validate_brief.py (the enforcing gate; this schema is the human/machine reference).",
  "type": "object",
  "additionalProperties": false,
  "required": ["slug", "covers", "pokemon", "key_cards", "opponent_properties"],
  "properties": {
    "slug": {"type": "string", "description": "matches the filename and data/meta/decks/<slug>/"},
    "label": {"type": "string", "description": "optional human label"},
    "covers": {
      "type": "array", "minItems": 1, "items": {"type": "string"},
      "description": "member Archetype strings (from index.json[slug].covers) — routes every variant to this one Brief; the Read matches read.candidates[0] against this list"
    },
    "authored": {"type": "string", "description": "ISO date the Brief was authored/updated"},
    "opponent_properties": {
      "type": "object",
      "description": "the levers — boolean/scalar weakness keys the (future) consumer maps onto Board. Every key must be registered in src/common/scouting/opponent_properties.json.",
      "additionalProperties": {"type": ["boolean", "string", "number"]}
    },
    "pokemon": {
      "type": "array",
      "description": "every strategically relevant Pokémon and its compact doctrine roles",
      "items": {
        "type": "object", "additionalProperties": false, "required": ["card", "roles"],
        "properties": {
          "card": {"type": "string"},
          "roles": {"type": "array", "minItems": 1, "items": {"type": "string", "enum": ["primary_attacker", "backup_attacker", "support", "energy_accel", "draw_engine", "disruption", "disruption_target", "wall", "starter", "threat"]}}
        }
      }
    },
    "key_cards": {"type": "array", "items": {"type": "object", "additionalProperties": false, "required": ["card", "role"], "properties": {"card": {"type": "string"}, "role": {"type": "string"}, "enables": {"type": "string"}}}},
    "strategies": {
      "type": "array",
      "description": "Opponent Strategies supplied by this scouting Brief.",
      "items": {
        "type": "object",
        "additionalProperties": false,
        "required": ["identifier", "conditions", "desired_facts", "recipient_selector", "deadline", "confidence"],
        "properties": {
          "identifier": {"type": "string"},
          "conditions": {"type": "array", "items": {"type": "object"}},
          "desired_facts": {"type": "array", "minItems": 1, "items": {"type": "object"}},
          "recipient_selector": {"type": "string"},
          "deadline": {"enum": ["immediate", "this_turn", "next_turn"]},
          "confidence": {"enum": ["high", "medium", "low"]},
          "enabled": {"type": "boolean"}
        }
      }
    },
    "sources": {"type": "array", "items": {"type": "string"}, "description": "citations (name — url)"}
  }
}
