{
  "slug": "cynthia_s_garchomp_ex_cynthia_s_roserade_cynthia_s_spiritomb",
  "label": "Cynthia's Garchomp ex / Cynthia's Roserade / Cynthia's Spiritomb",
  "covers": [
    "Cynthia's Garchomp ex / Cynthia's Roserade / Cynthia's Spiritomb"
  ],
  "authored": "2026-08-12",
  "opponent_properties": {
    "opp_tempo": "midrange",
    "opp_donk_vulnerable": true,
    "opp_effect_immune_bodies": true,
    "opp_comeback_disruptor": true
  },
  "pokemon": [
    {
      "card": "Cynthia's Gabite",
      "roles": [
        "backup_attacker",
        "disruption_target",
        "support"
      ]
    },
    {
      "card": "Cynthia's Garchomp ex",
      "roles": [
        "primary_attacker",
        "threat"
      ]
    },
    {
      "card": "Cynthia's Gible",
      "roles": [
        "backup_attacker"
      ]
    },
    {
      "card": "Cynthia's Roselia",
      "roles": [
        "backup_attacker",
        "support"
      ]
    },
    {
      "card": "Cynthia's Roserade",
      "roles": [
        "backup_attacker",
        "disruption_target",
        "support"
      ]
    },
    {
      "card": "Cynthia's Spiritomb",
      "roles": [
        "backup_attacker",
        "threat"
      ]
    }
  ],
  "key_cards": [
    {
      "card": "Cynthia's Power Weight",
      "role": "bulk_boost"
    },
    {
      "card": "Rock Fighting Energy",
      "role": "attack_effect_protection"
    },
    {
      "card": "Unfair Stamp",
      "role": "comeback_hand_disruption"
    }
  ]
}
